{"brief_hash":"sha256:98be7ba29bf0cfb8fad6b53fe48507f8c91d35b9ab872b5dc9aa09adc2422155","data_source":"fixture","engine":"python_demo_engine","engine_version":"0.1.0","executed_at":"2026-05-18T00:04:12.939664Z","hypothesis_id":"HYP-002-intraday-pass-demo","metrics":{"insample":{"avg_trade_r":0.45999999999999996,"max_drawdown":0.005990999999999904,"n_trades":10,"profit_factor":8.666666666666666,"sharpe":3.512007530059084,"win_rate":0.8},"outsample":{"avg_trade_r":0.55,"max_drawdown":0.005988007999999969,"n_trades":10,"profit_factor":10.166666666666666,"sharpe":3.3099447739257877,"win_rate":0.7}},"periods":{"insample":{"end":"2020-12-31","n_trades":10,"start":"2020-01-01"},"outsample":{"end":"2021-12-31","n_trades":10,"start":"2021-01-01"}},"result_hash":"sha256:ccf623d7ea04394a63e2a0a9ff3b6b9491f1ebb1ee84b894f177efb411592c71","risk_constraint_violations":{"discarded_trades":0,"reasons":{}},"spec_hash":"sha256:4c11795d45acc3e53ef65ecd8a0776126e77bae73d23f199297e61987800cdb0"}
